{
  "version": "CTB-002-study-v1",
  "status": "DESIGN_ONLY",
  "selected_master": "SOFT_CURVE",
  "working_concept": "B_THROUGH_ADHESIVE",
  "station_z_mm": [
    35,
    90,
    200,
    390
  ],
  "reference_z_mm": [
    35,
    90,
    245,
    390
  ],
  "spacer_thickness_mm": 6,
  "slot_allowance_each_side_mm": 0.2,
  "slot_corner_radius_mm": 0.2,
  "convex_corner_radius_mm": 0.5,
  "root_corner_radius_mm": 0.1,
  "minimum_cheek_land_hypothesis_mm": 6,
  "sheet_margin_mm": 10,
  "raster_dpi": 96,
  "ring_band_z_mm": [
    225,
    265
  ],
  "bypass_t_mm": [
    18.5,
    24.5
  ],
  "insertion_start_offset_t_mm": 40,
  "key_slide_r_mm": 6,
  "key_head_extra_length_t_mm": 4,
  "parts": {
    "P02": {
      "body_radial_width_mm": 30,
      "tab_radial_width_mm": 18,
      "key_neck_radial_width_mm": 12,
      "key_head_radial_width_mm": 20,
      "asymmetric_tab_width_mm": 8,
      "asymmetric_radial_offset_mm": 8
    },
    "P02B": {
      "body_radial_width_mm": 40,
      "tab_radial_width_mm": 24,
      "key_neck_radial_width_mm": 18,
      "key_head_radial_width_mm": 26,
      "asymmetric_tab_width_mm": 10,
      "asymmetric_radial_offset_mm": 8.5
    }
  },
  "actual_stock_thickness_mm": null,
  "measured_kerf_mm": null
}
